{
  "$schema": "http://json-schema.org/draft-07/schema#",
  "$id": "forzy://contracts/timeline/v1/historical-sensor-reading",
  "type": "object",
  "additionalProperties": false,
  "required": [
    "schemaVersion", "readingId", "samplePairId", "operatingCycleId",
    "assetId", "sensorId", "eventAt", "sourceTimestampText", "sourceKind",
    "timestampQuality", "measurements", "qualityFlags", "provenance"
  ],
  "properties": {
    "schemaVersion": { "const": "1.0" },
    "readingId": { "$ref": "#/definitions/uuid5" },
    "samplePairId": { "$ref": "#/definitions/uuid5" },
    "operatingCycleId": { "$ref": "#/definitions/uuid5" },
    "assetId": { "const": "forzy-motor-01" },
    "sensorId": { "enum": ["s1", "s2"] },
    "eventAt": { "$ref": "#/definitions/timestamp" },
    "sourceTimestampText": { "type": "string", "minLength": 1 },
    "sourceKind": { "const": "historical_archive" },
    "timestampQuality": { "const": "source_without_offset_assumed_timezone" },
    "measurements": { "$ref": "#/definitions/measurements" },
    "qualityFlags": {
      "type": "array",
      "items": { "type": "string", "minLength": 1 },
      "uniqueItems": true
    },
    "provenance": { "$ref": "#/definitions/historicalProvenance" }
  },
  "definitions": {
    "uuid5": {
      "type": "string",
      "pattern": "^[0-9a-f]{8}-[0-9a-f]{4}-5[0-9a-f]{3}-[89ab][0-9a-f]{3}-[0-9a-f]{12}$"
    },
    "timestamp": {
      "type": "string",
      "pattern": "^\\d{4}-(?:0[1-9]|1[0-2])-(?:0[1-9]|[12]\\d|3[01])T(?:[01]\\d|2[0-3]):[0-5]\\d:[0-5]\\d\\.\\d{3}Z$"
    },
    "hash": { "type": "string", "pattern": "^sha256:[0-9a-f]{64}$" },
    "velocity": {
      "type": "object",
      "additionalProperties": false,
      "required": ["value", "unit", "semanticConfidence"],
      "properties": {
        "value": { "type": "number" },
        "unit": { "const": "mm/s" },
        "semanticConfidence": {
          "enum": ["confirmed", "inferred_from_datasheet", "unconfirmed"]
        }
      }
    },
    "acceleration": {
      "type": "object",
      "additionalProperties": false,
      "required": ["value", "unit", "semanticConfidence", "statistic"],
      "properties": {
        "value": { "type": "number" },
        "unit": { "const": "g" },
        "semanticConfidence": {
          "enum": ["confirmed", "inferred_from_datasheet", "unconfirmed"]
        },
        "statistic": { "const": "unknown" }
      }
    },
    "temperature": {
      "type": "object",
      "additionalProperties": false,
      "required": ["value", "unit", "semanticConfidence"],
      "properties": {
        "value": { "type": "number" },
        "unit": { "const": "degC" },
        "semanticConfidence": {
          "enum": ["confirmed", "inferred_from_datasheet", "unconfirmed"]
        }
      }
    },
    "measurements": {
      "type": "object",
      "additionalProperties": false,
      "required": ["vibrationVelocityRms", "vibrationAcceleration", "temperature"],
      "properties": {
        "vibrationVelocityRms": { "$ref": "#/definitions/velocity" },
        "vibrationAcceleration": { "$ref": "#/definitions/acceleration" },
        "temperature": { "$ref": "#/definitions/temperature" }
      }
    },
    "historicalProvenance": {
      "type": "object",
      "additionalProperties": false,
      "required": [
        "sourceSystem", "batchId", "sourceFileSha256", "recordOrdinal",
        "sourceLineNumber", "rowSha256", "ingestedAt"
      ],
      "properties": {
        "sourceSystem": { "const": "forzy-csv" },
        "batchId": { "$ref": "#/definitions/hash" },
        "sourceFileSha256": { "$ref": "#/definitions/hash" },
        "recordOrdinal": { "type": "integer", "minimum": 1 },
        "sourceLineNumber": { "type": "integer", "minimum": 4 },
        "rowSha256": { "$ref": "#/definitions/hash" },
        "ingestedAt": { "$ref": "#/definitions/timestamp" }
      }
    }
  }
}
