{"schemaVersion":"1.0","readingId":"00000000-0000-5000-8000-000000000001","samplePairId":"00000000-0000-5000-8000-000000000002","operatingCycleId":"00000000-0000-5000-8000-000000000003","assetId":"forzy-motor-01","sensorId":"s1","eventAt":"2026-08-22T12:00:00.000Z","sourceTimestampText":"2026-08-22 09:00:00","sourceKind":"historical_archive","timestampQuality":"source_without_offset_assumed_timezone","measurements":{"vibrationVelocityRms":{"value":1.1,"unit":"mm/s","semanticConfidence":"confirmed"},"vibrationAcceleration":{"value":0,"unit":"g","semanticConfidence":"confirmed","statistic":"unknown"},"temperature":{"value":30,"unit":"degC","semanticConfidence":"confirmed"}},"qualityFlags":[],"provenance":{"sourceSystem":"forzy-csv","batchId":"sha256:aaaaaaaaaaaaaaaaaaaaaaaaaaaaaaaaaaaaaaaaaaaaaaaaaaaaaaaaaaaaaaaa","sourceFileSha256":"sha256:bbbbbbbbbbbbbbbbbbbbbbbbbbbbbbbbbbbbbbbbbbbbbbbbbbbbbbbbbbbbbbbb","recordOrdinal":1,"sourceLineNumber":4,"rowSha256":"sha256:cccccccccccccccccccccccccccccccccccccccccccccccccccccccccccccccc","ingestedAt":"2026-08-22T12:00:01.000Z"}}
